title,topic,difficulty,description,starter_code,solution,hint
Hello Streamlit,Getting Started,Easy,"Display the text ""Hello, Streamlit!"" on the page using Streamlit.",import streamlit as st,"import streamlit as st\n\nst.write(""Hello, Streamlit!"")",Use st.write().
Create a Page Title,Getting Started,Easy,"Display the page title ""My First Streamlit App"".",import streamlit as st,"import streamlit as st\n\nst.title(""My First Streamlit App"")",Use st.title().
Add a Header,Text Elements,Easy,Display a header named User Information.,import streamlit as st,"import streamlit as st\n\nst.header(""User Information"")",Use st.header().
Add a Subheader,Text Elements,Easy,Display a subheader named Contact Details.,import streamlit as st,"import streamlit as st\n\nst.subheader(""Contact Details"")",Use st.subheader().
Display Markdown,Text Elements,Easy,Display the text Python in bold using Markdown.,import streamlit as st,"import streamlit as st\n\nst.markdown(""**Python**"")",Use st.markdown().
Display Code,Text Elements,Easy,"Display the code print(""Hello"") inside a code block.",import streamlit as st,"import streamlit as st\n\nst.code('print(""Hello"")')",Use st.code().
Show Success Message,Alerts,Easy,Display a success message saying Data saved successfully!.,import streamlit as st,"import streamlit as st\n\nst.success(""Data saved successfully!"")",Use st.success().
Show Warning Message,Alerts,Easy,Display a warning message saying Please upload a file.,import streamlit as st,"import streamlit as st\n\nst.warning(""Please upload a file."")",Use st.warning().
Show Error Message,Alerts,Easy,Display an error message saying Invalid input!.,import streamlit as st,"import streamlit as st\n\nst.error(""Invalid input!"")",Use st.error().
Display a Caption,Text Elements,Easy,Display the caption Version 1.0.0 below the page content.,import streamlit as st,"import streamlit as st\n\nst.caption(""Version 1.0.0"")",Use st.caption().
Text Input,User Inputs,Easy,Create a text input labeled Enter your name.,import streamlit as st,"import streamlit as st\n\nst.text_input(""Enter your name"")",Use st.text_input().
Display User Name,User Inputs,Easy,"Create a text input labeled Enter your name and display Hello, <name>! after the user types their name.",import streamlit as st,"import streamlit as st\n\nname = st.text_input(""Enter your name"")\n\nif name:\n st.write(f""Hello, {name}!"")",Store the input in a variable.
Number Input,User Inputs,Easy,Create a number input labeled Enter your age.,import streamlit as st,"import streamlit as st\n\nst.number_input(""Enter your age"")",Use st.number_input().
Slider,User Inputs,Easy,Create a slider labeled Select your rating with values from 1 to 10.,import streamlit as st,"import streamlit as st\n\nst.slider(""Select your rating"", 1, 10)",Use st.slider().
Checkbox,User Inputs,Easy,Create a checkbox labeled I agree to the terms.,import streamlit as st,"import streamlit as st\n\nst.checkbox(""I agree to the terms"")",Use st.checkbox().
Radio Buttons,User Inputs,Easy,"Create radio buttons labeled Select your gender with options Male, Female, and Other.",import streamlit as st,"import streamlit as st\n\nst.radio(""Select your gender"", [""Male"", ""Female"", ""Other""])",Use st.radio().
Select Box,User Inputs,Easy,"Create a dropdown labeled Choose your favorite language with the options Python, SQL and Java.",import streamlit as st,"import streamlit as st\n\nst.selectbox(""Choose your favorite language"", [""Python"", ""SQL"", ""Java""])",Use st.selectbox().
Multiselect,User Inputs,Medium,"Create a multiselect labeled Select your skills with the options Python, SQL, Excel and Power BI.",import streamlit as st,"import streamlit as st\n\nst.multiselect(""Select your skills"", [""Python"", ""SQL"", ""Excel"", ""Power BI""])",Use st.multiselect().
Date Input,User Inputs,Medium,Create a date picker labeled Select your birthday.,import streamlit as st,"import streamlit as st\n\nst.date_input(""Select your birthday"")",Use st.date_input().
Time Input,User Inputs,Medium,Create a time picker labeled Select a meeting time.,import streamlit as st,"import streamlit as st\n\nst.time_input(""Select a meeting time"")",Use st.time_input().
Create a Button,Buttons,Easy,Create a button labeled Click Me.,import streamlit as st,"import streamlit as st\n\nst.button(""Click Me"")",Use st.button().
Button Success Message,Buttons,Easy,"Create a button labeled Submit. When the button is clicked, display Submitted Successfully! using a success message.",import streamlit as st,"import streamlit as st\n\nif st.button(""Submit""):\n st.success(""Submitted Successfully!"")",Check the return value of st.button().
Button Greeting,Buttons,Easy,"Create a text input labeled Enter your name and a button labeled Greet. When clicked, display Hello, !.",import streamlit as st,"import streamlit as st\n\nname = st.text_input(""Enter your name"")\n\nif st.button(""Greet""):\n st.write(f""Hello, {name}!"")",Combine st.text_input() and st.button().
Show Selected Language,Buttons,Medium,"Create a dropdown with Python, SQL and Java and a button labeled Show Selection. When clicked, display the selected language.",import streamlit as st,"import streamlit as st\n\nlanguage = st.selectbox(""Choose a language"", [""Python"", ""SQL"", ""Java""])\n\nif st.button(""Show Selection""):\n st.write(language)",Store the dropdown value first.
Calculate Square,Buttons,Medium,"Create a number input and a button labeled Calculate Square. When clicked, display the square of the entered number.",import streamlit as st,"import streamlit as st\n\nnum = st.number_input(""Enter a number"")\n\nif st.button(""Calculate Square""):\n st.write(num ** 2)",Use the exponent operator **.
Show Checkbox Status,Buttons,Medium,"Create a checkbox labeled Accept Terms and a button labeled Check Status. When clicked, display whether the checkbox is checked.",import streamlit as st,"import streamlit as st\n\naccepted = st.checkbox(""Accept Terms"")\n\nif st.button(""Check Status""):\n st.write(accepted)",Save the checkbox value in a variable.
BMI Calculator,Buttons,Medium,"Create two number inputs for Weight (kg) and Height (m) and a button labeled Calculate BMI. When clicked, display the BMI rounded to two decimal places.",import streamlit as st,"import streamlit as st\n\nweight = st.number_input(""Weight (kg)"")\nheight = st.number_input(""Height (m)"")\n\nif st.button(""Calculate BMI""):\n if height > 0:\n st.write(round(weight / (height ** 2), 2))",BMI = weight / height².
Password Checker,Buttons,Medium,"Create a password input and a button labeled Validate. If the password has at least 8 characters, display a success message; otherwise display an error message.",import streamlit as st,"import streamlit as st\n\npassword = st.text_input(""Password"", type=""password"")\n\nif st.button(""Validate""):\n if len(password) >= 8:\n st.success(""Strong password"")\n else:\n st.error(""Password too short"")","Use type=""password"" in st.text_input()."
Simple Login Screen,Buttons,Hard,"Create text inputs for username and password and a Login button. If the username is admin and the password is streamlit, display Login Successful; otherwise display Invalid Credentials.",import streamlit as st,"import streamlit as st\n\nusername = st.text_input(""Username"")\npassword = st.text_input(""Password"", type=""password"")\n\nif st.button(""Login""):\n if username == ""admin"" and password == ""streamlit"":\n st.success(""Login Successful"")\n else:\n st.error(""Invalid Credentials"")",Compare both username and password inside the button block.
Mini Registration Form,Buttons,Hard,"Create text inputs for Name and Email and a Register button. When clicked, display a success message showing the entered name and email.",import streamlit as st,"import streamlit as st\n\nname = st.text_input(""Name"")\nemail = st.text_input(""Email"")\n\nif st.button(""Register""):\n st.success(f""Registered {name} ({email})"")",Use an f-string inside st.success().
Initialize Session State,Session State,Easy,Initialize a session state variable named count with a value of 0 if it doesn't already exist.,import streamlit as st,"import streamlit as st\n\nif ""count"" not in st.session_state:\n st.session_state.count = 0",Check if the key exists before creating it.
Display Counter,Session State,Easy,Initialize a session state variable named count and display its current value on the page.,import streamlit as st,"import streamlit as st\n\nif ""count"" not in st.session_state:\n st.session_state.count = 0\n\nst.write(st.session_state.count)",Use st.session_state.count.
Increment Counter,Session State,Easy,Create a button labeled Increment. Every click should increase the counter by 1 and display the updated value.,import streamlit as st,"import streamlit as st\n\nif ""count"" not in st.session_state:\n st.session_state.count = 0\n\nif st.button(""Increment""):\n st.session_state.count += 1\n\nst.write(st.session_state.count)",Modify the session state inside the button block.
Decrement Counter,Session State,Easy,Create a button labeled Decrement. Every click should decrease the counter by 1.,import streamlit as st,"import streamlit as st\n\nif ""count"" not in st.session_state:\n st.session_state.count = 0\n\nif st.button(""Decrement""):\n st.session_state.count -= 1\n\nst.write(st.session_state.count)",Subtract 1 instead of adding 1.
Reset Counter,Session State,Medium,Create Increment and Reset buttons. Increment increases the counter. Reset sets it back to 0.,import streamlit as st,"import streamlit as st\n\nif ""count"" not in st.session_state:\n st.session_state.count = 0\n\nif st.button(""Increment""):\n st.session_state.count += 1\n\nif st.button(""Reset""):\n st.session_state.count = 0\n\nst.write(st.session_state.count)",Use two different buttons.
Persistent Name,Session State,Medium,Create a text input for a user's name and store it in session state so it persists between reruns. Display the stored name below the input.,import streamlit as st,"import streamlit as st\n\nif ""name"" not in st.session_state:\n st.session_state.name = """"\n\nst.session_state.name = st.text_input(""Name"", value=st.session_state.name)\n\nst.write(st.session_state.name)",Use the text input's value to update session state.
Toggle Message,Session State,Medium,Create a button labeled Toggle. Every click should alternate between displaying ON and OFF.,import streamlit as st,"import streamlit as st\n\nif ""on"" not in st.session_state:\n st.session_state.on = False\n\nif st.button(""Toggle""):\n st.session_state.on = not st.session_state.on\n\nst.write(""ON"" if st.session_state.on else ""OFF"")",Flip a boolean value.
Visit Counter,Session State,Medium,"Every time the app reruns, increase a session state variable named visits by 1 and display the total number of visits.",import streamlit as st,"import streamlit as st\n\nif ""visits"" not in st.session_state:\n st.session_state.visits = 0\n\nst.session_state.visits += 1\n\nst.write(f""Visits: {st.session_state.visits}"")",Increment outside of any button.
Shopping Cart Counter,Session State,Hard,Create an Add to Cart button. Each click should increase the number of items in the cart and display the total.,import streamlit as st,"import streamlit as st\n\nif ""cart"" not in st.session_state:\n st.session_state.cart = 0\n\nif st.button(""Add to Cart""):\n st.session_state.cart += 1\n\nst.write(f""Items in cart: {st.session_state.cart}"")",This is just a counter with a different purpose.
Simple Score Tracker,Session State,Hard,Create Correct Answer and Wrong Answer buttons. Correct Answer,sldokgjalskdg,asdgasdg,asdgasdg
Create Two Columns,Layout,Easy,Create two equal-width columns. Display Column 1 in the first column and Column 2 in the second column.,import streamlit as st,"import streamlit as st\n\ncol1, col2 = st.columns(2)\n\nwith col1:\n st.write(""Column 1"")\n\nwith col2:\n st.write(""Column 2"")",Use st.columns(2).
Three Columns,Layout,Easy,"Create three equal-width columns displaying A, B, and C respectively.",import streamlit as st,"import streamlit as st\n\ncol1, col2, col3 = st.columns(3)\n\nwith col1:\n st.write(""A"")\n\nwith col2:\n st.write(""B"")\n\nwith col3:\n st.write(""C"")",Create three column objects.
Sidebar Title,Sidebar,Easy,Add the title Dashboard Menu to the sidebar.,import streamlit as st,"import streamlit as st\n\nst.sidebar.title(""Dashboard Menu"")",Use st.sidebar.
Sidebar Selectbox,Sidebar,Easy,"Create a sidebar dropdown labeled Choose a Page with the options Home, Reports and Settings.",import streamlit as st,"import streamlit as st\n\nst.sidebar.selectbox(""Choose a Page"", [""Home"", ""Reports"", ""Settings""])",Widgets can be placed inside the sidebar.
Use a Container,Layout,Medium,Create a container and display a title Sales Dashboard followed by the text Welcome! inside it.,import streamlit as st,"import streamlit as st\n\nwith st.container():\n st.title(""Sales Dashboard"")\n st.write(""Welcome!"")",Use with st.container():.
Create an Expander,Layout,Medium,"Create an expander titled Show Details. Inside it, display These are additional details.",import streamlit as st,"import streamlit as st\n\nwith st.expander(""Show Details""):\n st.write(""These are additional details."")",Use st.expander().
Create Tabs,Layout,Medium,Create two tabs named Profile and Settings. Display the tab name inside each tab.,import streamlit as st,"import streamlit as st\n\ntab1, tab2 = st.tabs([""Profile"", ""Settings""])\n\nwith tab1:\n st.write(""Profile"")\n\nwith tab2:\n st.write(""Settings"")",Use st.tabs().
Add a Divider,Layout,Medium,"Display the text Before Divider, add a divider, then display After Divider.",import streamlit as st,"import streamlit as st\n\nst.write(""Before Divider"")\nst.divider()\nst.write(""After Divider"")",Use st.divider().
Update Placeholder,Layout,Hard,Create an empty placeholder. Display Loading... in it and then replace it with Completed!.,import streamlit as st\nimport time,"import streamlit as st\nimport time\n\nplaceholder = st.empty()\n\nplaceholder.write(""Loading..."")\ntime.sleep(2)\nplaceholder.write(""Completed!"")",st.empty() returns a placeholder that can be updated.
Dashboard Layout,Layout,Hard,"Create a sidebar titled Navigation. In the main page, display two columns. The left column should contain the title Sales and the right column should contain the title Profit.",import streamlit as st,"import streamlit as st\n\nst.sidebar.title(""Navigation"")\n\ncol1, col2 = st.columns(2)\n\nwith col1:\n st.title(""Sales"")\n\nwith col2:\n st.title(""Profit"")",Combine the sidebar and columns in the same app.
Display a DataFrame,Data Display,Easy,"Create a DataFrame with one column named Name containing Alice, Bob and Charlie. Display it using Streamlit.",import streamlit as st\nimport pandas as pd,"import streamlit as st\nimport pandas as pd\n\ndf = pd.DataFrame({""Name"": [""Alice"", ""Bob"", ""Charlie""]})\n\nst.dataframe(df)",Use pd.DataFrame() and st.dataframe().
Display a Table,Data Display,Easy,Create a DataFrame containing Name and Age columns and display it as a static table.,import streamlit as st\nimport pandas as pd,"import streamlit as st\nimport pandas as pd\n\ndf = pd.DataFrame({""Name"":[""Alice"",""Bob""],""Age"":[24,30]})\n\nst.table(df)",Use st.table().
Show DataFrame Shape,Data Display,Easy,Create a DataFrame with three rows and two columns. Display the DataFrame and then display its shape.,import streamlit as st\nimport pandas as pd,"import streamlit as st\nimport pandas as pd\n\ndf = pd.DataFrame({""A"":[1,2,3],""B"":[4,5,6]})\n\nst.dataframe(df)\nst.write(df.shape)",Every DataFrame has a .shape attribute.
Display Selected Column,Data Display,Easy,Create a DataFrame with Name and Age columns. Display only the Name column.,import streamlit as st\nimport pandas as pd,"import streamlit as st\nimport pandas as pd\n\ndf = pd.DataFrame({""Name"":[""Alice"",""Bob""],""Age"":[24,30]})\n\nst.dataframe(df[[""Name""]])",Select only one column before displaying it.
Filter Rows,Data Display,Medium,Create a DataFrame with Name and Age columns. Display only the rows where Age is greater than 25.,import streamlit as st\nimport pandas as pd,"import streamlit as st\nimport pandas as pd\n\ndf = pd.DataFrame({""Name"":[""Alice"",""Bob"",""Charlie""],""Age"":[24,30,28]})\n\nst.dataframe(df[df[""Age""] > 25])",Use boolean indexing.
Sort a DataFrame,Data Display,Medium,Create a DataFrame containing Name and Score columns. Display it sorted by Score in descending order.,import streamlit as st\nimport pandas as pd,"import streamlit as st\nimport pandas as pd\n\ndf = pd.DataFrame({""Name"":[""Alice"",""Bob"",""Charlie""],""Score"":[85,95,90]})\n\nst.dataframe(df.sort_values(""Score"", ascending=False))",Use sort_values().
Display Summary Statistics,Data Display,Medium,Create a DataFrame containing a Score column. Display the summary statistics for the DataFrame.,import streamlit as st\nimport pandas as pd,"import streamlit as st\nimport pandas as pd\n\ndf = pd.DataFrame({""Score"":[80,90,85,95]})\n\nst.dataframe(df.describe())",Use describe().
Display Data Based on User Selection,Data Display,Medium,Create a DataFrame with Name and Department columns. Create a dropdown that lets the user select a department and display only the matching rows.,import streamlit as st\nimport pandas as pd,"import streamlit as st\nimport pandas as pd\n\ndf = pd.DataFrame({""Name"":[""Alice"",""Bob"",""Charlie""],""Department"":[""HR"",""IT"",""HR""]})\n\ndepartment = st.selectbox(""Department"", df[""Department""].unique())\n\nst.dataframe(df[df[""Department""] == department])",Use the selected value to filter the DataFrame.
Display Top 5 Rows,Data Display,Hard,Create a DataFrame with at least 10 rows and display only the first five rows.,import streamlit as st\nimport pandas as pd,"import streamlit as st\nimport pandas as pd\n\ndf = pd.DataFrame({""Number"": range(1,11)})\n\nst.dataframe(df.head())",Use .head().
Download a CSV,Data Display,Hard,Create a DataFrame containing Name and Score columns. Display it and add a button that lets the user download it as a CSV file.,import streamlit as st\nimport pandas as pd,"import streamlit as st\nimport pandas as pd\n\ndf = pd.DataFrame({""Name"":[""Alice"",""Bob""],""Score"":[90,85]})\n\nst.dataframe(df)\n\ncsv = df.to_csv(index=False)\n\nst.download_button(""Download CSV"", csv, ""scores.csv"", ""text/csv"")",Convert the DataFrame to CSV using to_csv(index=False).
Upload a File,File Uploads,Easy,Create a file uploader that accepts any file type.,import streamlit as st,"import streamlit as st\n\nst.file_uploader(""Choose a file"")",Use st.file_uploader().
Upload a CSV File,File Uploads,Easy,Create a file uploader that only accepts CSV files.,import streamlit as st,"import streamlit as st\n\nst.file_uploader(""Upload CSV"", type=""csv"")",Use the type parameter.
Display Uploaded File Name,File Uploads,Easy,"Create a file uploader. After the user uploads a file, display its name.",import streamlit as st,"import streamlit as st\n\nuploaded_file = st.file_uploader(""Upload a file"")\n\nif uploaded_file is not None:\n st.write(uploaded_file.name)",The uploaded file object has a .name attribute.
Read and Display a CSV,File Uploads,Medium,"Create a CSV uploader. After a file is uploaded, read it using pandas and display it as a DataFrame.",import streamlit as st\nimport pandas as pd,"import streamlit as st\nimport pandas as pd\n\nuploaded_file = st.file_uploader(""Upload CSV"", type=""csv"")\n\nif uploaded_file is not None:\n df = pd.read_csv(uploaded_file)\n st.dataframe(df)",Pass the uploaded file directly to pd.read_csv().
Display CSV Shape,File Uploads,Medium,Upload a CSV file and display the number of rows and columns in the uploaded DataFrame.,import streamlit as st\nimport pandas as pd,"import streamlit as st\nimport pandas as pd\n\nuploaded_file = st.file_uploader(""Upload CSV"", type=""csv"")\n\nif uploaded_file is not None:\n df = pd.read_csv(uploaded_file)\n st.write(df.shape)",Use the DataFrame's .shape attribute.
Display First Five Rows,File Uploads,Medium,Upload a CSV file and display only the first five rows.,import streamlit as st\nimport pandas as pd,"import streamlit as st\nimport pandas as pd\n\nuploaded_file = st.file_uploader(""Upload CSV"", type=""csv"")\n\nif uploaded_file is not None:\n df = pd.read_csv(uploaded_file)\n st.dataframe(df.head())",Use .head().
Upload Multiple Files,File Uploads,Medium,Create a file uploader that allows users to upload multiple CSV files. Display the name of each uploaded file.,import streamlit as st,"import streamlit as st\n\nfiles = st.file_uploader(""Upload CSV files"", type=""csv"", accept_multiple_files=True)\n\nfor file in files:\n st.write(file.name)",Set accept_multiple_files=True.
Upload and Preview an Image,File Uploads,Medium,"Create an image uploader. After the user uploads an image, display it in the app.",import streamlit as st,"import streamlit as st\n\nimage = st.file_uploader(""Upload an image"", type=[""png"",""jpg"",""jpeg""])\n\nif image is not None:\n st.image(image)",Use st.image().
Upload an Excel File,File Uploads,Hard,"Create an Excel file uploader. After upload, read the file using pandas and display the DataFrame.",import streamlit as st\nimport pandas as pd,"import streamlit as st\nimport pandas as pd\n\nuploaded_file = st.file_uploader(""Upload Excel"", type=[""xlsx""])\n\nif uploaded_file is not None:\n df = pd.read_excel(uploaded_file)\n st.dataframe(df)",Use pd.read_excel().
CSV Summary App,File Uploads,Hard,"Create a CSV uploader. After upload, display the DataFrame, its shape, column names, and summary statistics.",import streamlit as st\nimport pandas as pd,"import streamlit as st\nimport pandas as pd\n\nuploaded_file = st.file_uploader(""Upload CSV"", type=""csv"")\n\nif uploaded_file is not None:\n df = pd.read_csv(uploaded_file)\n st.dataframe(df)\n st.write(df.shape)\n st.write(df.columns.tolist())\n st.dataframe(df.describe())",Use df.columns.tolist() and df.describe().
Line Chart,Charts,Easy,"Create a DataFrame with a column named Sales containing the values 10, 20, 15, 25 and 30. Display it as a line chart.",import streamlit as st\nimport pandas as pd,"import streamlit as st\nimport pandas as pd\n\ndf = pd.DataFrame({""Sales"":[10,20,15,25,30]})\n\nst.line_chart(df)",Use st.line_chart().
Bar Chart,Charts,Easy,Create a DataFrame with Product and Sales columns. Display the Sales values as a bar chart.,import streamlit as st\nimport pandas as pd,"import streamlit as st\nimport pandas as pd\n\ndf = pd.DataFrame({""Product"":[""A"",""B"",""C""],""Sales"":[100,150,120]})\n\nst.bar_chart(df.set_index(""Product""))",Set the Product column as the index.
Area Chart,Charts,Easy,Create a DataFrame containing monthly revenue and display it as an area chart.,import streamlit as st\nimport pandas as pd,"import streamlit as st\nimport pandas as pd\n\ndf = pd.DataFrame({""Revenue"":[200,250,220,300,280]})\n\nst.area_chart(df)",Use st.area_chart().
Plotly Line Chart,Charts,Medium,Create a Plotly line chart showing monthly sales and display it in Streamlit.,import streamlit as st\nimport pandas as pd\nimport plotly.express as px,"import streamlit as st\nimport pandas as pd\nimport plotly.express as px\n\ndf = pd.DataFrame({""Month"":[""Jan"",""Feb"",""Mar"",""Apr""],""Sales"":[120,150,180,170]})\n\nfig = px.line(df, x=""Month"", y=""Sales"")\n\nst.plotly_chart(fig)",Use px.line().
Plotly Bar Chart,Charts,Medium,Create a Plotly bar chart showing sales for three products and display it.,import streamlit as st\nimport pandas as pd\nimport plotly.express as px,"import streamlit as st\nimport pandas as pd\nimport plotly.express as px\n\ndf = pd.DataFrame({""Product"":[""A"",""B"",""C""],""Sales"":[100,150,120]})\n\nfig = px.bar(df, x=""Product"", y=""Sales"")\n\nst.plotly_chart(fig)",Use px.bar().
Plotly Scatter Plot,Charts,Medium,Create a scatter plot comparing Hours Studied and Exam Score using Plotly.,import streamlit as st\nimport pandas as pd\nimport plotly.express as px,"import streamlit as st\nimport pandas as pd\nimport plotly.express as px\n\ndf = pd.DataFrame({""Hours"":[1,2,3,4,5],""Score"":[50,60,75,85,95]})\n\nfig = px.scatter(df, x=""Hours"", y=""Score"")\n\nst.plotly_chart(fig)",Use px.scatter().
Plotly Pie Chart,Charts,Medium,Create a pie chart showing sales by category using Plotly.,import streamlit as st\nimport pandas as pd\nimport plotly.express as px,"import streamlit as st\nimport pandas as pd\nimport plotly.express as px\n\ndf = pd.DataFrame({""Category"":[""Electronics"",""Furniture"",""Clothing""],""Sales"":[400,300,200]})\n\nfig = px.pie(df, names=""Category"", values=""Sales"")\n\nst.plotly_chart(fig)",Use px.pie().
Interactive Chart Filter,Charts,Hard,Create a DataFrame containing Product and Sales. Add a selectbox that lets the user choose a product and display only the selected product as a bar chart.,import streamlit as st\nimport pandas as pd\nimport plotly.express as px,"import streamlit as st\nimport pandas as pd\nimport plotly.express as px\n\ndf = pd.DataFrame({""Product"":[""A"",""B"",""C""],""Sales"":[100,150,120]})\n\nproduct = st.selectbox(""Select Product"", df[""Product""])\n\nfiltered = df[df[""Product""] == product]\n\nfig = px.bar(filtered, x=""Product"", y=""Sales"")\n\nst.plotly_chart(fig)",Filter the DataFrame before creating the chart.
